{
  "$schema": "../../../schemas/oracle-record.schema.json",
  "artifactSha256": "7f2a5cb9c2c239ec9e19f0b6838d431202f58f88ed6dbd21e78cf1a574743912",
  "colorSpace": "srgb",
  "comparisonPolicyId": "pixel-exact-swiftshader-pw-1-61-v1",
  "environmentId": "sha256-48ce42bae26460428ad4bcc1bb526ddd00abc7a5960f62919bb88026bdb1a084",
  "flightCommit": "b3eea5f93b4df315e1bc80cc7af37a9fce30e49d",
  "height": 600,
  "identity": {
    "entry": "material-alpha-map-pbr",
    "renderer": "webgpu",
    "subject": "functional"
  },
  "pack": "functional-scene3d",
  "pixelFormat": "rgba8",
  "pixelSha256": "4ee510c15c4e0ea49a256e0124acb6a7f098f1a9c6b436f5ec92503d85613409",
  "provenance": {
    "frames": 1,
    "sourceHash": "1f7bbfc3290d9a5fa93b68e90c2b63ba48d0d2d29b1cdd8cab408319e3fb7ecc",
    "targetKind": "webgpu",
    "verifyPublished": true,
    "warmupFrames": 0
  },
  "request": {
    "id": "e4492c94-9938-4fe4-a6f5-68b25b259f34",
    "sha256": "e749cd4000b4c003dadc4ad36d313652957b27341aabbc191cdcded2da4c6cfd"
  },
  "schemaVersion": 1,
  "width": 800
}
