{
  "$schema": "../../../schemas/oracle-record.schema.json",
  "artifactSha256": "6a8e944af433f1aebd9fbb341f79a7c8f8cb16c7a35fb3f13c38e613b0db04aa",
  "colorSpace": "srgb",
  "comparisonPolicyId": "pixel-exact-swiftshader-pw-1-61-v1",
  "environmentId": "sha256-48ce42bae26460428ad4bcc1bb526ddd00abc7a5960f62919bb88026bdb1a084",
  "flightCommit": "b3eea5f93b4df315e1bc80cc7af37a9fce30e49d",
  "height": 600,
  "identity": {
    "entry": "material-alpha-map-pbr",
    "renderer": "webgl",
    "subject": "functional"
  },
  "pack": "functional-scene3d",
  "pixelFormat": "rgba8",
  "pixelSha256": "95aec27eb262c9905785bf45e84858bec7287bbfb4ea8bcdb1c9b42207406d55",
  "provenance": {
    "frames": 1,
    "sourceHash": "b298b89c3dd7aefe3d6f7d969b3e987799217671adf9ed24ce4a8e2c819ad9d0",
    "targetKind": null,
    "verifyPublished": true,
    "warmupFrames": 0
  },
  "request": {
    "id": "e4492c94-9938-4fe4-a6f5-68b25b259f34",
    "sha256": "e749cd4000b4c003dadc4ad36d313652957b27341aabbc191cdcded2da4c6cfd"
  },
  "schemaVersion": 1,
  "width": 800
}
