{
  "$schema": "../../../schemas/oracle-record.schema.json",
  "artifactSha256": "ec14429a117c54cca8e8d95f521046a423913cfb04b579d26100254884fc2836",
  "colorSpace": "srgb",
  "comparisonPolicyId": "pixel-exact-swiftshader-pw-1-61-v1",
  "environmentId": "sha256-48ce42bae26460428ad4bcc1bb526ddd00abc7a5960f62919bb88026bdb1a084",
  "flightCommit": "b82d313abae5abbfe0568f8a0ecf7e7cf834d269",
  "height": 600,
  "identity": {
    "entry": "mesh-tangent-mirrored-uv",
    "renderer": "webgpu",
    "subject": "functional"
  },
  "pack": "functional-scene3d",
  "pixelFormat": "rgba8",
  "pixelSha256": "779eee23c1d17fa76cfb3fe0fa87d0f74d523fcf0c9f3ca6fbd08532751e1fa9",
  "provenance": {
    "frames": 1,
    "sourceHash": "1c77377c8ba4a2642069a909b16fcc7f684ca405516a3b2d825776e5905da1d7",
    "targetKind": "webgpu",
    "verifyPublished": true,
    "warmupFrames": 0
  },
  "request": {
    "id": "67c6ec71-e394-4dfd-9138-7b75fe8f390b",
    "sha256": "bce465732554db3bc1903302f5064d31af5cc5e2b1ac28945e4fec42071486c9"
  },
  "schemaVersion": 1,
  "width": 800
}
