{
  "$schema": "../../../schemas/oracle-record.schema.json",
  "artifactSha256": "759a6b94a8328f2d384653810f5cfb5bdc393e9206bcd6d39212cc31d7f9f3c5",
  "colorSpace": "srgb",
  "comparisonPolicyId": "pixel-exact-swiftshader-pw-1-61-v1",
  "environmentId": "sha256-48ce42bae26460428ad4bcc1bb526ddd00abc7a5960f62919bb88026bdb1a084",
  "flightCommit": "54f97d868253fefb8e74e59b3d615ea9df99d8d5",
  "height": 450,
  "identity": {
    "entry": "particle-emitter",
    "renderer": "webgpu",
    "subject": "functional"
  },
  "pack": "functional-other",
  "pixelFormat": "rgba8",
  "pixelSha256": "41e2698be232e56d8924238cc1903639ccb9a99597f97a740928d921e1edc33d",
  "provenance": {
    "frames": 1,
    "sourceHash": "3b0014c053fccefc13a15456576b982f9300e3debe644b444fe726e457280807",
    "targetKind": "webgpu",
    "verifyPublished": true,
    "warmupFrames": 0
  },
  "request": {
    "id": "fbca78dd-3f41-4060-a1bf-9e051a395ae6",
    "sha256": "e6d06d73a29cd4c9c76a24b1f6ac431348c5880ed6cabdfa918e982e839be953"
  },
  "schemaVersion": 1,
  "width": 800
}
