{
  "$schema": "../../../schemas/oracle-record.schema.json",
  "artifactSha256": "84f0502ee93c4dc76afa0e1a087f212704ea09b393776712910fd192c4b5adcd",
  "colorSpace": "srgb",
  "comparisonPolicyId": "pixel-exact-swiftshader-pw-1-61-v1",
  "environmentId": "sha256-48ce42bae26460428ad4bcc1bb526ddd00abc7a5960f62919bb88026bdb1a084",
  "flightCommit": "129b76d4025138e3fbbe6fcdccc31a89f6bfd500",
  "height": 600,
  "identity": {
    "entry": "bitmap-smoothing",
    "renderer": "canvas",
    "subject": "functional"
  },
  "pack": "functional-images",
  "pixelFormat": "rgba8",
  "pixelSha256": "6221c8eafdc69285c0f0e28324d3413486882c4088515681373c5c776639f841",
  "provenance": {
    "frames": 1,
    "sourceHash": "ef9b72dc495c4300a8e2da775bb4712d5235d0a0311de1038bd5e32facf5063e",
    "targetKind": "canvas",
    "verifyPublished": true,
    "warmupFrames": 0
  },
  "request": {
    "id": "d814ef8a-ddee-4307-9a4d-943afdab3290",
    "sha256": "018fc3716ced2b5e2053d662eaa722e7b30b390d5bb2a17c7190941adbe51c06"
  },
  "schemaVersion": 1,
  "width": 800
}
