{
  "$schema": "../../../schemas/oracle-record.schema.json",
  "artifactSha256": "5e2877cc204bc8286300b941dfa9a753fab1a3e27e2ebfdb179be6fd3c56fd40",
  "colorSpace": "srgb",
  "comparisonPolicyId": "pixel-exact-swiftshader-pw-1-61-v1",
  "environmentId": "sha256-48ce42bae26460428ad4bcc1bb526ddd00abc7a5960f62919bb88026bdb1a084",
  "flightCommit": "00028b0f581f46010a9ba6f4d34a54cbfbe90ac0",
  "height": 600,
  "identity": {
    "entry": "text-bold",
    "renderer": "canvas",
    "subject": "functional"
  },
  "pack": "functional-text",
  "pixelFormat": "rgba8",
  "pixelSha256": "6b66b239125dc9d0f3127377db427368f27266646cb1d509dad2f5213762e44a",
  "provenance": {
    "frames": 1,
    "sourceHash": "a6600101cff3507a02dbb0b6d25fb9d300d3a44e4d8d5cbda39d2718d84445a5",
    "targetKind": "canvas",
    "verifyPublished": true,
    "warmupFrames": 0
  },
  "request": {
    "id": "bcd4bc25-ca5b-463a-883c-59086c2d0c41",
    "sha256": "f962e5ddc82283533badc4ddd09b212e9149641ae458063d91726317cc7b27cd"
  },
  "schemaVersion": 1,
  "width": 800
}
