{
  "$schema": "../../../schemas/oracle-record.schema.json",
  "artifactSha256": "480134ad530380ea623aed31b0e757c217a0e3cb02006ff089336d476b4d3ce3",
  "colorSpace": "srgb",
  "comparisonPolicyId": "pixel-exact-swiftshader-pw-1-61-v1",
  "environmentId": "sha256-48ce42bae26460428ad4bcc1bb526ddd00abc7a5960f62919bb88026bdb1a084",
  "flightCommit": "598ef6f62b6f1ae2873956501069ed824699021a",
  "height": 600,
  "identity": {
    "entry": "shadow-scene-scale",
    "renderer": "webgpu",
    "subject": "functional"
  },
  "pack": "functional-scene3d",
  "pixelFormat": "rgba8",
  "pixelSha256": "de4dccd2824c8b7dde83eeb10deb9df1f4a8e23c426a85749606d8d42a4221a7",
  "provenance": {
    "frames": 1,
    "sourceHash": "0e7050ab1ecc524fb1df8224604be0a9cf40e53968829a172207797e18ec769c",
    "targetKind": "webgpu",
    "verifyPublished": true,
    "warmupFrames": 0
  },
  "request": {
    "id": "f894bcf5-ad3a-4634-96c0-cfb8030ffd98",
    "sha256": "6ca5b6a533a41b3369dd048f2313f421521a12efcf0c491f6d51e72355e238df"
  },
  "schemaVersion": 1,
  "width": 800
}
