{
  "$schema": "../../../schemas/oracle-record.schema.json",
  "artifactSha256": "89cade75f0e237bd3fd41715eb3d7de2b8636321a9d0410c9afbb9206cbfcfba",
  "colorSpace": "srgb",
  "comparisonPolicyId": "pixel-exact-swiftshader-pw-1-61-v1",
  "environmentId": "sha256-48ce42bae26460428ad4bcc1bb526ddd00abc7a5960f62919bb88026bdb1a084",
  "flightCommit": "54f97d868253fefb8e74e59b3d615ea9df99d8d5",
  "height": 300,
  "identity": {
    "entry": "path-boolean-xor",
    "renderer": "dom",
    "subject": "functional"
  },
  "pack": "functional-shapes",
  "pixelFormat": "rgba8",
  "pixelSha256": "c0de0537acc80f6c73b85a6ac0d8acedecbd19eef162f54758c83bb1850d0c94",
  "provenance": {
    "frames": 1,
    "sourceHash": "22e86828bf2d858d51841efa610ee60ba3771b2ea7ca3644b2493bea821876ad",
    "targetKind": "dom",
    "verifyPublished": false,
    "warmupFrames": 0
  },
  "request": {
    "id": "9c96fcb4-40a4-46d5-a8b3-33e80790e702",
    "sha256": "d9f0295be81cae55a4268dda2ab2af531818ec1e3532a8832268f37a608d8ea8"
  },
  "schemaVersion": 1,
  "width": 300
}
