{
  "$schema": "../../../schemas/oracle-record.schema.json",
  "artifactSha256": "887a734270801a2f472f5e8b4f18aa84897fb44f5c760b3d969972123d207a9f",
  "colorSpace": "srgb",
  "comparisonPolicyId": "pixel-exact-swiftshader-pw-1-61-v1",
  "environmentId": "sha256-48ce42bae26460428ad4bcc1bb526ddd00abc7a5960f62919bb88026bdb1a084",
  "flightCommit": "54f97d868253fefb8e74e59b3d615ea9df99d8d5",
  "height": 600,
  "identity": {
    "entry": "shape-stroke",
    "renderer": "dom",
    "subject": "functional"
  },
  "pack": "functional-shapes",
  "pixelFormat": "rgba8",
  "pixelSha256": "79de6e9460c1b41e9617ff9ec0004e6937ae2f26a7f1e402bfc14ee97d0165d5",
  "provenance": {
    "frames": 1,
    "sourceHash": "b4d229834a7f37528563ad6c82918715ff4d02965807102c207a65baab005b10",
    "targetKind": "dom",
    "verifyPublished": false,
    "warmupFrames": 0
  },
  "request": {
    "id": "1947b6be-5351-4d40-a089-60cdd4080ace",
    "sha256": "a19741f5e5a9ca150ec009b50f0956044fe107a558abf1d7725891ba63f9a9b6"
  },
  "schemaVersion": 1,
  "width": 800
}
