{
  "$schema": "../../../schemas/oracle-record.schema.json",
  "artifactSha256": "49c7ec842d54fd32f340b97e8f98b128fd2f9b469d267c3e73acbbff37c77a3e",
  "colorSpace": "srgb",
  "comparisonPolicyId": "pixel-exact-swiftshader-pw-1-61-v1",
  "environmentId": "sha256-48ce42bae26460428ad4bcc1bb526ddd00abc7a5960f62919bb88026bdb1a084",
  "flightCommit": "f69160b30438f81d8ec0f7641b68cd1acef88df2",
  "height": 600,
  "identity": {
    "entry": "shadow-classic",
    "renderer": "webgl",
    "subject": "functional"
  },
  "pack": "functional-scene3d",
  "pixelFormat": "rgba8",
  "pixelSha256": "430712de0c61eef2bec1ad76b12e22c8dbad43ed80e7884d97ca9a2f39c73e4e",
  "provenance": {
    "frames": 1,
    "sourceHash": "cd4a99314e543a79951f90794e6d6fb9c3749a501b4fcbfa7695fc6ac000ccb4",
    "targetKind": null,
    "verifyPublished": true,
    "warmupFrames": 0
  },
  "request": {
    "id": "fc735acf-440d-4503-913d-143b52d4d534",
    "sha256": "8f3eac5fa3b9da5b6ea061bbfa9165c474eae5edac943f889476abaf39ae6dd9"
  },
  "schemaVersion": 1,
  "width": 800
}
